{
  "kind": "CapabilityRegistry",
  "schemaVersion": "0.1.0",
  "registryVersion": "0.1.0",
  "generatedBy": "tools/build-capability-registry.mjs",
  "capabilities": [
    {
      "kind": "CapabilityDefinition",
      "schemaVersion": "0.1.0",
      "id": "ai.agents",
      "domain": "ai",
      "title": "AI Agents",
      "doc": "capabilities/ai/AI_AGENTS.md",
      "ownerDomain": "engineering",
      "generationPhase": "P0",
      "executionPhase": "LATER",
      "maxAutomationLevel": "AUTOMATED",
      "dependsOn": [],
      "conflictsWith": [],
      "externalActionScopes": [],
      "consentRequired": false,
      "deterministicFirst": true,
      "costProfile": "LOW",
      "status": "STUB"
    },
    {
      "kind": "CapabilityDefinition",
      "schemaVersion": "0.1.0",
      "id": "ai.caching",
      "domain": "ai",
      "title": "Caching",
      "doc": "capabilities/ai/CACHING.md",
      "ownerDomain": "engineering",
      "generationPhase": "P1",
      "executionPhase": "LATER",
      "maxAutomationLevel": "AUTOMATED",
      "dependsOn": [],
      "conflictsWith": [],
      "externalActionScopes": [],
      "consentRequired": false,
      "deterministicFirst": true,
      "costProfile": "LOW",
      "status": "STUB"
    },
    {
      "kind": "CapabilityDefinition",
      "schemaVersion": "0.1.0",
      "id": "ai.claude_code",
      "domain": "ai",
      "title": "Claude Code",
      "doc": "capabilities/ai/CLAUDE_CODE.md",
      "ownerDomain": "engineering",
      "generationPhase": "P0",
      "executionPhase": "P0",
      "maxAutomationLevel": "AUTOMATED",
      "dependsOn": [],
      "conflictsWith": [],
      "externalActionScopes": [],
      "consentRequired": false,
      "deterministicFirst": true,
      "costProfile": "LOW",
      "status": "STUB"
    },
    {
      "kind": "CapabilityDefinition",
      "schemaVersion": "0.1.0",
      "id": "ai.codex",
      "domain": "ai",
      "title": "Codex",
      "doc": "capabilities/ai/CODEX.md",
      "ownerDomain": "engineering",
      "generationPhase": "P0",
      "executionPhase": "P0",
      "maxAutomationLevel": "AUTOMATED",
      "dependsOn": [],
      "conflictsWith": [],
      "externalActionScopes": [],
      "consentRequired": false,
      "deterministicFirst": true,
      "costProfile": "LOW",
      "status": "STUB"
    },
    {
      "kind": "CapabilityDefinition",
      "schemaVersion": "0.1.0",
      "id": "ai.context_engineering",
      "domain": "ai",
      "title": "Context Engineering",
      "doc": "capabilities/ai/CONTEXT_ENGINEERING.md",
      "ownerDomain": "engineering",
      "generationPhase": "P0",
      "executionPhase": "LATER",
      "maxAutomationLevel": "AUTOMATED",
      "dependsOn": [],
      "conflictsWith": [],
      "externalActionScopes": [],
      "consentRequired": false,
      "deterministicFirst": true,
      "costProfile": "LOW",
      "status": "STUB"
    },
    {
      "kind": "CapabilityDefinition",
      "schemaVersion": "0.1.0",
      "id": "ai.cursor_adapter",
      "domain": "ai",
      "title": "Cursor Adapter",
      "doc": "capabilities/ai/CURSOR_ADAPTER.md",
      "ownerDomain": "engineering",
      "generationPhase": "P0",
      "executionPhase": "P0",
      "maxAutomationLevel": "AUTOMATED",
      "dependsOn": [],
      "conflictsWith": [],
      "externalActionScopes": [],
      "consentRequired": false,
      "deterministicFirst": true,
      "costProfile": "LOW",
      "status": "STUB"
    },
    {
      "kind": "CapabilityDefinition",
      "schemaVersion": "0.1.0",
      "id": "ai.embeddings",
      "domain": "ai",
      "title": "Embeddings",
      "doc": "capabilities/ai/EMBEDDINGS.md",
      "ownerDomain": "engineering",
      "generationPhase": "P1",
      "executionPhase": "LATER",
      "maxAutomationLevel": "AUTOMATED",
      "dependsOn": [],
      "conflictsWith": [],
      "externalActionScopes": [],
      "consentRequired": false,
      "deterministicFirst": true,
      "costProfile": "LOW",
      "status": "STUB"
    },
    {
      "kind": "CapabilityDefinition",
      "schemaVersion": "0.1.0",
      "id": "ai.evals",
      "domain": "ai",
      "title": "Evals",
      "doc": "capabilities/ai/EVALS.md",
      "ownerDomain": "engineering",
      "generationPhase": "P0",
      "executionPhase": "LATER",
      "maxAutomationLevel": "AUTOMATED",
      "dependsOn": [],
      "conflictsWith": [],
      "externalActionScopes": [],
      "consentRequired": false,
      "deterministicFirst": true,
      "costProfile": "LOW",
      "status": "STUB"
    },
    {
      "kind": "CapabilityDefinition",
      "schemaVersion": "0.1.0",
      "id": "ai.fallbacks",
      "domain": "ai",
      "title": "Fallbacks",
      "doc": "capabilities/ai/FALLBACKS.md",
      "ownerDomain": "engineering",
      "generationPhase": "P1",
      "executionPhase": "LATER",
      "maxAutomationLevel": "AUTOMATED",
      "dependsOn": [],
      "conflictsWith": [],
      "externalActionScopes": [],
      "consentRequired": false,
      "deterministicFirst": true,
      "costProfile": "LOW",
      "status": "STUB"
    },
    {
      "kind": "CapabilityDefinition",
      "schemaVersion": "0.1.0",
      "id": "ai.guardrails",
      "domain": "ai",
      "title": "Guardrails",
      "doc": "capabilities/ai/GUARDRAILS.md",
      "ownerDomain": "engineering",
      "generationPhase": "P0",
      "executionPhase": "LATER",
      "maxAutomationLevel": "AUTOMATED",
      "dependsOn": [],
      "conflictsWith": [],
      "externalActionScopes": [],
      "consentRequired": false,
      "deterministicFirst": true,
      "costProfile": "LOW",
      "status": "STUB"
    },
    {
      "kind": "CapabilityDefinition",
      "schemaVersion": "0.1.0",
      "id": "ai.human_approval",
      "domain": "ai",
      "title": "Human Approval",
      "doc": "capabilities/ai/HUMAN_APPROVAL.md",
      "ownerDomain": "engineering",
      "generationPhase": "P0",
      "executionPhase": "LATER",
      "maxAutomationLevel": "AUTOMATED",
      "dependsOn": [],
      "conflictsWith": [],
      "externalActionScopes": [],
      "consentRequired": false,
      "deterministicFirst": true,
      "costProfile": "LOW",
      "status": "STUB"
    },
    {
      "kind": "CapabilityDefinition",
      "schemaVersion": "0.1.0",
      "id": "ai.mcp_connectors",
      "domain": "ai",
      "title": "Mcp Connectors",
      "doc": "capabilities/ai/MCP_CONNECTORS.md",
      "ownerDomain": "engineering",
      "generationPhase": "P2",
      "executionPhase": "LATER",
      "maxAutomationLevel": "AUTOMATED",
      "dependsOn": [],
      "conflictsWith": [],
      "externalActionScopes": [],
      "consentRequired": false,
      "deterministicFirst": true,
      "costProfile": "LOW",
      "status": "STUB"
    },
    {
      "kind": "CapabilityDefinition",
      "schemaVersion": "0.1.0",
      "id": "ai.model_routing",
      "domain": "ai",
      "title": "Model Routing",
      "doc": "capabilities/ai/MODEL_ROUTING.md",
      "ownerDomain": "engineering",
      "generationPhase": "P0",
      "executionPhase": "LATER",
      "maxAutomationLevel": "AUTOMATED",
      "dependsOn": [],
      "conflictsWith": [],
      "externalActionScopes": [],
      "consentRequired": false,
      "deterministicFirst": true,
      "costProfile": "VARIABLE",
      "status": "STUB"
    },
    {
      "kind": "CapabilityDefinition",
      "schemaVersion": "0.1.0",
      "id": "ai.prompt_registry",
      "domain": "ai",
      "title": "Prompt Registry",
      "doc": "capabilities/ai/PROMPT_REGISTRY.md",
      "ownerDomain": "engineering",
      "generationPhase": "P1",
      "executionPhase": "LATER",
      "maxAutomationLevel": "AUTOMATED",
      "dependsOn": [],
      "conflictsWith": [],
      "externalActionScopes": [],
      "consentRequired": false,
      "deterministicFirst": true,
      "costProfile": "LOW",
      "status": "STUB"
    },
    {
      "kind": "CapabilityDefinition",
      "schemaVersion": "0.1.0",
      "id": "ai.rag",
      "domain": "ai",
      "title": "Rag",
      "doc": "capabilities/ai/RAG.md",
      "ownerDomain": "engineering",
      "generationPhase": "P1",
      "executionPhase": "LATER",
      "maxAutomationLevel": "AUTOMATED",
      "dependsOn": [],
      "conflictsWith": [],
      "externalActionScopes": [],
      "consentRequired": false,
      "deterministicFirst": true,
      "costProfile": "VARIABLE",
      "status": "STUB"
    },
    {
      "kind": "CapabilityDefinition",
      "schemaVersion": "0.1.0",
      "id": "ai.structured_output",
      "domain": "ai",
      "title": "Structured Output",
      "doc": "capabilities/ai/STRUCTURED_OUTPUT.md",
      "ownerDomain": "engineering",
      "generationPhase": "P0",
      "executionPhase": "LATER",
      "maxAutomationLevel": "AUTOMATED",
      "dependsOn": [],
      "conflictsWith": [],
      "externalActionScopes": [],
      "consentRequired": false,
      "deterministicFirst": true,
      "costProfile": "LOW",
      "status": "STUB"
    },
    {
      "kind": "CapabilityDefinition",
      "schemaVersion": "0.1.0",
      "id": "ai.token_harness",
      "domain": "ai",
      "title": "Token Harness",
      "doc": "capabilities/ai/TOKEN_HARNESS.md",
      "ownerDomain": "engineering",
      "generationPhase": "P0",
      "executionPhase": "LATER",
      "maxAutomationLevel": "AUTOMATED",
      "dependsOn": [],
      "conflictsWith": [],
      "externalActionScopes": [],
      "consentRequired": false,
      "deterministicFirst": true,
      "costProfile": "LOW",
      "status": "STUB"
    },
    {
      "kind": "CapabilityDefinition",
      "schemaVersion": "0.1.0",
      "id": "ai.tool_use",
      "domain": "ai",
      "title": "Tool Use",
      "doc": "capabilities/ai/TOOL_USE.md",
      "ownerDomain": "engineering",
      "generationPhase": "P1",
      "executionPhase": "LATER",
      "maxAutomationLevel": "AUTOMATED",
      "dependsOn": [],
      "conflictsWith": [],